name,id,all_cleaned
Stoutland,508,"Stoutland: id: 508 - nickname: Big-hearted Pokémon - type: normal - height: 1.2 - weight: 61.0; descriptions: With this wise Pokémon, there could be no concern that it would ever attack people. Some parents even trust it to babysit.; Its fur is long and thick. A long time ago in cold regions, every household kept a Stoutland.; Intelligent, good natured, and valiant, it's a trustworthy partner on rescue teams.; It pays no mind to the cold, thanks to its long warm coat. Stoutland in Alola look a little uncomfortable.; This extremely wise Pokémon excels at rescuing people stranded at sea or in the mountains.; These Pokémon seem to enjoy living with humans. Even a Stoutland caught in the wild will warm up to people in about three days.; It rescues people stranded by blizzards in the mountains. Its shaggy fur shields it from the cold.; Being wrapped in its long fur is so comfortable that a person would be fine even overnight on a wintry mountain.; Stoutland is immensely proud of its impressive moustache. It's said that moustache length is what determines social standing among this species."
Purrloin,509,"Purrloin: id: 509 - nickname: Devious Pokémon - type: dark - height: 0.4 - weight: 10.1; descriptions: It steals things from people just to amuse itself with their frustration. A rivalry exists between this Pokémon and Nickit.; Their cute act is a ruse. They trick people and steal their valuables just to see the looks on their faces.; They steal from people for fun, but their victims can't help but forgive them. Their deceptively cute act is perfect.; Its cute act is a ruse. When victims let down their guard, they find their items taken. It attacks with sharp claws.; Opponents that get drawn in by its adorable behavior come away with stinging scratches from its claws and stinging pride from its laughter."
Liepard,510,"Liepard: id: 510 - nickname: Cruel Pokémon - type: dark - height: 1.1 - weight: 37.5; descriptions: Don't be fooled by its gorgeous fur and elegant figure. This is a moody and vicious Pokémon.; These Pokémon vanish and appear unexpectedly. Many Trainers are drawn to their beautiful form and fur.; Stealthily, it sneaks up on its target, striking from behind before its victim has a chance to react.; Their beautiful form comes from the muscles they have developed. They run silently in the night.; This stealthy Pokémon sneaks up behind prey without making any sound at all. It competes with Thievul for territory."
Pansage,511,Pansage: id: 511 - nickname: Grass Monkey Pokémon - type: grass - height: 0.6 - weight: 10.5; descriptions: It's good at finding berries and gathers them from all over. It's kind enough to share them with friends.; It shares the leaf on its head with weary looking Pokémon. These leaves are known to relieve stress.; This Pokémon dwells deep in the forest. Eating a leaf from its head whisks weariness away as if by magic.
Simisage,512,"Simisage: id: 512 - nickname: Thorn Monkey Pokémon - type: grass - height: 1.1 - weight: 30.5; descriptions: Ill tempered, it fights by swinging its barbed tail around wildly. The leaf growing on its head is very bitter.; It strikes its enemies with a thorn covered tail. The leaf on its head is bitter.; It attacks enemies with strikes of its thorn covered tail. This Pokémon is wild tempered."
Pansear,513,"Pansear: id: 513 - nickname: High Temp Pokémon - type: fire - height: 0.6 - weight: 11.0; descriptions: When it is angered, the temperature of its head tuft reaches 600 F. It uses its tuft to roast berries.; This Pokémon lives in caves in volcanoes. The fire within the tuft on its head can reach 600 degrees Fahrenheit.; Very intelligent, it roasts berries before eating them. It likes to help people.; This Pokémon lives in caves in volcanoes. The fire within the tuft on its head can reach 600 F."
Simisear,514,"Simisear: id: 514 - nickname: Ember Pokémon - type: fire - height: 1.0 - weight: 28.0; descriptions: A flame burns inside its body. It scatters embers from its head and tail to sear its opponents.; When it gets excited, embers rise from its head and tail and it gets hot. For some reason, it loves sweets.; It loves sweets because they become energy for the fire burning inside its body."
Panpour,515,Panpour: id: 515 - nickname: Spray Pokémon - type: water - height: 0.6 - weight: 13.5; descriptions: The water stored inside the tuft on its head is full of nutrients. Plants that receive its water grow large.; It does not thrive in dry environments. It keeps itself damp by shooting water stored in its head tuft from its tail.; The water stored inside the tuft on its head is full of nutrients. It waters plants with it using its tail.
Simipour,516,"Simipour: id: 516 - nickname: Geyser Pokémon - type: water - height: 1.0 - weight: 29.0; descriptions: The tuft on its head holds water. When the level runs low, it replenishes the tuft by siphoning up water with its tail.; It prefers places with clean water. When its tuft runs low, it replenishes it by siphoning up water with its tail.; The high pressure water expelled from its tail is so powerful, it can destroy a concrete wall."
Munna,517,"Munna: id: 517 - nickname: Dream Eater Pokémon - type: psychic - height: 0.6 - weight: 23.3; descriptions: It eats the dreams of people and Pokémon. When it eats a pleasant dream, it expels pink colored mist.; It eats dreams and releases mist. The mist is pink when it's eating a good dream, and black when it's eating a nightmare.; Munna always float in the air. People whose dreams are eaten by them forget what the dreams had been about.; Late at night, it appears beside people's pillows. As it feeds on dreams, the patterns on its body give off a faint glow.; This Pokémon appears before people and Pokémon who are having nightmares and eats those dreams."
Musharna,518,"Musharna: id: 518 - nickname: Drowsing Pokémon - type: psychic - height: 1.1 - weight: 60.5; descriptions: When dark mists emanate from its body, don't get too near. If you do, your nightmares will become reality.; The mist emanating from their foreheads is packed with the dreams of people and Pokémon.; It drowses and dreams all the time. It's best to leave it be if it's just woken up, as it's a terrible grump when freshly roused from sleep.; With the mist from its forehead, it can create shapes of things from dreams it has eaten.; The dream mist coming from its forehead changes into many different colors depending on the dream that was eaten."
Pidove,519,"Pidove: id: 519 - nickname: Tiny Pigeon Pokémon - type: normal and flying - height: 0.3 - weight: 2.1; descriptions: This very forgetful Pokémon will wait for a new order from its Trainer even though it already has one.; These Pokémon live in cities. They are accustomed to people. Flocks often gather in parks and plazas.; Each follows its Trainer's orders as best it can, but they sometimes fail to understand complicated commands.; Where people go, these Pokémon follow. If you're scattering food for them, be careful several hundred of them can gather at once.; It's forgetful and not very bright, but many Trainers love it anyway for its friendliness and sincerity."
Tranquill,520,"Tranquill: id: 520 - nickname: Wild Pigeon Pokémon - type: normal and flying - height: 0.6 - weight: 15.0; descriptions: Many people believe that, deep in the forest where Tranquill live, there is a peaceful place where there is no war.; It can fly moderately quickly. No matter how far it travels, it can always find its way back to its master and its nest.; These bright Pokémon have acute memories. Apparently delivery workers often choose them as their partners.; It can return to its Trainer's location regardless of the distance separating them.; No matter where in the world it goes, it knows where its nest is, so it never gets separated from its Trainer."
Unfezant,521,"Unfezant: id: 521 - nickname: Proud Pokémon - type: normal and flying - height: 1.2 - weight: 29.0; descriptions: Males swing their head plumage to threaten opponents. The females' flying abilities surpass those of the males.; Males swing the plumage on their heads to threaten others, but females are better at flying.; Unfezant are exceptional fliers. The females are known for their stamina, while the males outclass them in terms of speed.; This Pokémon is intelligent and intensely proud. People will sit up and take notice if you become the Trainer of one.; Males have plumage on their heads. They will never let themselves feel close to anyone other than their Trainers."
Blitzle,522,"Blitzle: id: 522 - nickname: Electrified Pokémon - type: electric - height: 0.8 - weight: 29.8; descriptions: When thunderclouds cover the sky, it will appear. It can catch lightning with its mane and store the electricity.; Its mane shines when it discharges electricity. They use the frequency and rhythm of these flashes to communicate.; Its mane shines when it discharges electricity. They use their flashing manes to communicate with one another."
Zebstrika,523,"Zebstrika: id: 523 - nickname: Thunderbolt Pokémon - type: electric - height: 1.6 - weight: 79.5; descriptions: They have lightning like movements. When Zebstrika run at full speed, the sound of thunder reverberates.; When this ill tempered Pokémon runs wild, it shoots lightning from its mane in all directions.; This ill tempered Pokémon is dangerous because when it's angry, it shoots lightning from its mane in all directions."
Roggenrola,524,"Roggenrola: id: 524 - nickname: Mantle Pokémon - type: rock - height: 0.4 - weight: 18.0; descriptions: It's as hard as steel, but apparently a long soak in water will cause it to soften a bit.; They were discovered a hundred years ago in an earthquake fissure. Inside each one is an energy core.; When it detects a noise, it starts to move. The energy core inside it makes this Pokémon slightly warm to the touch.; The hexagonal hole is its ear. Deep in that ear is an energy core, so if you stick your hand in there, Roggenrola will be very angry; Born deep within the ground, it compares itself with similar species, such as Geodude and Carbink, to settle which has the hardest body.; The hexagonal cavity is its ear. It walks in the direction of sounds it hears, but if the sounds cease, it panics and topples over.; Its ear is hexagonal in shape. Compressed underground, its body is as hard as steel.; The hexagonal shaped hole is its ear. It has a tendency to walk in the direction the sound is coming from.; It was found in a fissure in a layer of exposed rock. The material that makes up its body is dirt from several hundred years ago."
Boldore,525,"Boldore: id: 525 - nickname: Ore Pokémon - type: rock - height: 0.9 - weight: 102.0; descriptions: It explores caves in search of underground water. It's not comfortable around water, so this Pokémon takes great care in lapping it up.; When it overflows with power, the orange crystal on its body glows. It looks for underground water in caves.; Its orange crystals are lumps of powerful energy. They're valuable, so Boldore is sometimes targeted for them.; When it is healthy, its core sticks out. Always facing the same way, it swiftly moves front to back and left to right.; Because its energy was too great to be contained, the energy leaked and formed orange crystals.; The energy overflowing from its body has turned into orange crystals that are hard enough to smash diamonds.; It relies on sound in order to monitor what's in its vicinity. When angered, it will attack without ever changing the direction it's facing.; Its orange crystal is a mass of energy. Just one crystal fragment would provide enough fuel for a hundred dump trucks.; If you see its orange crystals start to glow, be wary. It's about to fire off bursts of energy."
Gigalith,526,"Gigalith: id: 526 - nickname: Compressed Pokémon - type: rock - height: 1.7 - weight: 260.0; descriptions: The blasts of energy it makes from sunbeams have terrifying power. However, it's not able to fire its blasts at night or on rainy days.; The solar rays it absorbs are processed in its energy core and fired as a ball of light.; The solar energy absorbed by its body's orange crystals is magnified internally and fired from its mouth.; When it fires off energy with all its might, the power creates countless fissures on its body.; Known for its hefty horsepower, this Pokémon is a popular partner for construction workers.; Compressing the energy from its internal core lets it fire off an attack capable of blowing away a mountain.; This hardy Pokémon can often be found on construction sites and in mines, working alongside people and Copperajah.; It absorbs rays of sunlight and shoots out energy. It's usually lurking deep beneath the surface.; Although its energy blasts can blow away a dump truck, they have a limitation they can only be fired when the sun is out."
Woobat,527,"Woobat: id: 527 - nickname: Bat Pokémon - type: psychic and flying - height: 0.4 - weight: 2.1; descriptions: The heart shaped mark left on a body after a Woobat has been attached to it is said to bring good fortune.; Suction from its nostrils enables it to stick to cave walls during sleep. It leaves a heart shaped mark behind.; While inside a cave, if you look up and see lots of heart shaped marks lining the walls, it's evidence that Woobat live there.; It emits ultrasonic waves as it flutters about, searching for its prey bug Pokémon.; Its habitat is dark forests and caves. It emits ultrasonic waves from its nose to learn about its surroundings."
Swoobat,528,"Swoobat: id: 528 - nickname: Courting Pokémon - type: psychic and flying - height: 0.9 - weight: 10.5; descriptions: The auspicious shape of this Pokémon's nose apparently led some regions to consider Swoobat a symbol of good luck.; Anyone who comes into contact with the ultrasonic waves emitted by a courting male experiences a positive mood shift.; It emits sound waves of various frequencies from its nose, including some powerful enough to destroy rocks.; It shakes its tail vigorously when it emits ultrasonic waves strong enough to reduce concrete to rubble.; Emitting powerful sound waves tires it out. Afterward, it won't be able to fly for a little while."
Drilbur,529,"Drilbur: id: 529 - nickname: Mole Pokémon - type: ground - height: 0.3 - weight: 8.5; descriptions: By spinning its body, it can dig straight through the ground at a speed of 30 mph.; It makes its way swiftly through the soil by putting both claws together and rotating at high speed.; It brings its claws together and whirls around at high speed before rushing toward its prey.; It can dig through the ground at a speed of 30 mph. It could give a car running aboveground a good race.; It's a digger, using its claws to burrow through the ground. It causes damage to vegetable crops, so many farmers have little love for it."
Excadrill,530,"Excadrill: id: 530 - nickname: Subterrene Pokémon - type: ground and steel - height: 0.7 - weight: 40.4; descriptions: Known as the Drill King, this Pokémon can tunnel through the terrain at speeds of over 90 mph.; It can help in tunnel construction. Its drill has evolved into steel strong enough to bore through iron plates.; It's not uncommon for tunnels that appear to have formed naturally to actually be a result of Excadrill's rampant digging.; More than 300 feet below the surface, they build mazelike nests. Their activity can be destructive to subway tunnels.; Forming a drill with its steel claws and head, it can bore through a steel plate, no matter how thick it is."
Audino,531,"Audino: id: 531 - nickname: Hearing Pokémon - type: normal - height: 1.1 - weight: 31.0; descriptions: Audino's sense of hearing is superb. Not even a pebble rolling along over a mile away will escape Audino's ears.; Its auditory sense is astounding. It has a radarlike ability to understand its surroundings through slight sounds.; Using the feelers on its ears, it can tell how someone is feeling or when an egg might hatch.; This Pokémon has a kind heart. By touching with its feelers, Audino can gauge other creatures' feelings and physical conditions.; It touches others with the feelers on its ears, using the sound of their heartbeats to tell how they are feeling."
Timburr,532,"Timburr: id: 532 - nickname: Muscular Pokémon - type: fighting - height: 0.6 - weight: 12.5; descriptions: These Pokémon appear at building sites and help out with construction. They always carry squared logs.; It fights by swinging a piece of lumber around. It is close to evolving when it can handle the lumber without difficulty.; It loves helping out with construction projects. It loves it so much that if rain causes work to halt, it swings its log around and throws a tantrum.; Always carrying squared logs, they help out with construction. As they grow, they carry bigger logs.; Timburr that have started carrying logs that are about three times their size are nearly ready to evolve."
Gurdurr,533,"Gurdurr: id: 533 - nickname: Muscular Pokémon - type: fighting - height: 1.2 - weight: 40.0; descriptions: With strengthened bodies, they skillfully wield steel beams to take down buildings.; This Pokémon is so muscular and strongly built that even a group of wrestlers could not make it budge an inch.; Gurdurr excels at demolition construction is not its forte. In any case, there's skill in the way this Pokémon wields its metal beam.; It shows off its muscles to Machoke and other Gurdurr. If it fails to measure up to the other Pokémon, it lies low for a little while.; They strengthen their bodies by carrying steel beams. They show off their big muscles to their friends."
Conkeldurr,534,"Conkeldurr: id: 534 - nickname: Muscular Pokémon - type: fighting - height: 1.4 - weight: 87.0; descriptions: Rather than rely on force, they master moves that utilize the centrifugal force of spinning concrete.; When going all out, this Pokémon throws aside its concrete pillars and leaps at opponents to pummel them with its fists.; Concrete mixed by Conkeldurr is much more durable than normal concrete, even when the compositions of the two materials are the same.; They use concrete pillars as walking canes. They know moves that enable them to swing the pillars freely in battle.; It is thought that Conkeldurr taught humans how to make concrete more than 2,000 years ago."
Tympole,535,"Tympole: id: 535 - nickname: Tadpole Pokémon - type: water - height: 0.5 - weight: 4.5; descriptions: By vibrating its cheeks, it emits sound waves imperceptible to humans. It uses the rhythm of these sounds to talk.; Graceful ripples running across the water's surface are a sure sign that Tympole are singing in high pitched voices below.; They warn others of danger by vibrating their cheeks to create a high pitched sound.; By vibrating its cheeks, it emits sound waves imperceptible to humans and warns others of danger.; It uses sound waves to communicate with others of its kind. People and other Pokémon species can't hear its cries of warning."
Palpitoad,536,"Palpitoad: id: 536 - nickname: Vibration Pokémon - type: water and ground - height: 0.8 - weight: 17.0; descriptions: It lives in the water and on land. It uses its long, sticky tongue to capture prey.; When they vibrate the bumps on their heads, they can make waves in water or earthquake like vibrations on land.; It lives in the water and on land. It uses its long, sticky tongue to immobilize its opponents.; On occasion, their cries are sublimely pleasing to the ear. Palpitoad with larger lumps on their bodies can sing with a wider range of sounds.; It weakens its prey with sound waves intense enough to cause headaches, then entangles them with its sticky tongue."
Seismitoad,537,"Seismitoad: id: 537 - nickname: Vibration Pokémon - type: water and ground - height: 1.5 - weight: 62.0; descriptions: They shoot paralyzing liquid from their head bumps. They use vibration to hurt their opponents.; By putting power into its bumps, it creates vibrations and increases the power of its punches.; This Pokémon is popular among the elderly, who say the vibrations of its lumps are great for massages.; It increases the power of its punches by vibrating the bumps on its fists. It can turn a boulder to rubble with one punch.; The vibrating of the bumps all over its body causes earthquake like tremors. Seismitoad and Croagunk are similar species."
Throh,538,"Throh: id: 538 - nickname: Judo Pokémon - type: fighting - height: 1.3 - weight: 55.5; descriptions: When it encounters a foe bigger than itself, it wants to throw it. It changes belts as it gets stronger.; It performs throwing moves with first rate skill. Over the course of many battles, Throh's belt grows darker as it absorbs its wearer's sweat.; When it tightens its belt, it becomes stronger. Wild Throh use vines to weave their own belts.; They train in groups of five. Any member that can't keep up will discard its belt and leave the group.; When they encounter foes bigger than themselves, they try to throw them. They always travel in packs of five."
Sawk,539,"Sawk: id: 539 - nickname: Karate Pokémon - type: fighting - height: 1.4 - weight: 51.0; descriptions: Tying their belts gets them pumped and makes their punches more destructive. Disturbing their training angers them.; The sound of Sawk punching boulders and trees can be heard all the way from the mountains where they train.; If you see a Sawk training in the mountains in its single minded pursuit of strength, it's best to quietly pass by.; The karate chops of a Sawk that's trained itself to the limit can cleave the ocean itself.; Desiring the strongest karate chop, they seclude themselves in mountains and train without sleeping."
Sewaddle,540,"Sewaddle: id: 540 - nickname: Sewing Pokémon - type: bug and grass - height: 0.3 - weight: 2.5; descriptions: Leavanny dress it in clothes they made for it when it hatched. It hides its head in its hood while it is sleeping.; This Pokémon makes clothes for itself. It chews up leaves and sews them with sticky thread extruded from its mouth.; Since this Pokémon makes its own clothes out of leaves, it is a popular mascot for fashion designers."
Swadloon,541,"Swadloon: id: 541 - nickname: Leaf-wrapped Pokémon - type: bug and grass - height: 0.5 - weight: 7.3; descriptions: Preferring dark, damp places, it spends the entire day eating fallen leaves that lie around it.; It protects itself from the cold by wrapping up in leaves. It stays on the move, eating leaves in forests.; Forests where Swadloon live have superb foliage because the nutrients they make from fallen leaves nourish the plant life."
Leavanny,542,"Leavanny: id: 542 - nickname: Nurturing Pokémon - type: bug and grass - height: 1.2 - weight: 20.5; descriptions: Upon finding a small Pokémon, it weaves clothing for it from leaves, using the cutters on its arms and sticky silk.; It keeps its eggs warm with heat from fermenting leaves. It also uses leaves to make warm wrappings for Sewaddle.; Upon finding a small Pokémon, it weaves clothing for it from leaves by using the sticky silk secreted from its mouth."
Venipede,543,"Venipede: id: 543 - nickname: Centipede Pokémon - type: bug and poison - height: 0.4 - weight: 5.3; descriptions: Its bite injects a potent poison, enough to paralyze large bird Pokémon that try to prey on it.; It discovers what is going on around it by using the feelers on its head and tail. It is brutally aggressive.; Its fangs are highly venomous. If this Pokémon finds prey it thinks it can eat, it leaps for them without any thought of how things might turn out.; Venipede and Sizzlipede are similar species, but when the two meet, a huge fight ensues.; Using the feelers on its head and tail, it picks up vibrations in the air to determine its prey's location and state."
Whirlipede,544,"Whirlipede: id: 544 - nickname: Curlipede Pokémon - type: bug and poison - height: 1.2 - weight: 58.5; descriptions: It is usually motionless, but when attacked, it rotates at high speed and then crashes into its opponent.; Whirlipede protects itself with a sturdy shell and poisonous spikes while it stores up the energy it'll need for evolution.; Protected by a hard shell, it spins its body like a wheel and crashes furiously into its enemies.; Storing energy for evolution, it sits. But, when predators approach, it moves to stab them with poison spikes.; This Pokémon spins itself rapidly and charges into its opponents. Its top speed is just over 60 mph."
Scolipede,545,"Scolipede: id: 545 - nickname: Megapede Pokémon - type: bug and poison - height: 2.5 - weight: 200.5; descriptions: Scolipede engage in fierce territorial battles with Centiskorch. At the end of one of these battles, the victor makes a meal of the loser.; With quick movements, it chases down its foes, attacking relentlessly with its horns until it prevails.; Scolipede latches on to its prey with the claws on its neck before slamming them into the ground and jabbing them with its claws' toxic spikes.; Highly aggressive, it uses the claws near its neck to dig into its opponents and poison them.; It clasps its prey with the claws on its neck until it stops moving. Then it finishes it off with deadly poison."
