name,id,all_cleaned
Nosepass,299,"Nosepass: id: 299 - nickname: Compass Pokémon - type: rock - height: 1.0 - weight: 97.0; descriptions: Its magnetic nose consistently faces north. Travelers check Nosepass to get their bearings.; Its magnetic nose always faces north and draws iron objects to its body to protect itself better.; If two of these meet, they cannot get too close because their noses repel each other.; The magnet in Nosepass's nose provides an unerring compass, making it an excellent partner for Trainers going on a journey.; Nosepass had been said to be completely unmoving, with its magnetic nose pointed due north. However, close observation has revealed that the Pokémon actually moves by a little over 3 8 of an inch every year.; It moves less than an inch a year, but when it's in a jam, it will spin and drill down into the ground in a split second.; Once the people of Hisui discovered that its red nose always points north, they grew to rely on it greatly when traveling afar. The nose seems to work in a similar way to ancient compasses.; Its nose is a magnet. As a result, this Pokémon always keeps its face pointing north.; Nosepass's magnetic nose is always pointed to the north. If two of these Pokémon meet, they cannot turn their faces to each other when they are close because their magnetic noses repel one another.; When endangered, it may protect itself by raising its magnetism and drawing iron objects to its body.; It uses powerful magnetism to drag its prey toward it. It's also been known to pull in metal, which it collects and uses to protect itself.; It hunts without twitching a muscle by pulling in its prey with powerful magnetism. But sometimes it pulls natural enemies in close.; Its body emits a powerful magnetism. It feeds on prey that is pulled in by the force. Its magnetism is stronger in cold seasons."
Skitty,300,"Skitty: id: 300 - nickname: Kitten Pokémon - type: normal - height: 0.6 - weight: 11.0; descriptions: Skitty has the habit of becoming fascinated by moving objects and chasing them around. This Pokémon is known to chase after its own tail and become dizzy.; It shows its cute side by chasing its own tail until it gets dizzy.; A Skitty's adorably cute behavior makes it highly popular. In battle, it makes its tail puff out. It threatens foes with a sharp growl.; It can't stop itself from chasing moving things, and it runs in a circle, chasing its own tail.; Skitty is known to chase around playfully after its own tail. In the wild, this Pokémon lives in holes in the trees of forests. It is very popular as a pet because of its adorable looks.; It's adorable when it chases its own tail. It's difficult to earn its trust.; It is said to be difficult to earn its trust. However, it is extremely popular for its cute looks and behavior."
Delcatty,301,"Delcatty: id: 301 - nickname: Prim Pokémon - type: normal - height: 1.1 - weight: 32.6; descriptions: Delcatty sleeps anywhere it wants without keeping a permanent nest. If other Pokémon approach it as it sleeps, this Pokémon will never fight it will just move away somewhere else.; It is highly popular among female Trainers for its sublime fur. It does not keep a nest.; Delcatty prefers to live an unfettered existence in which it can do as it pleases at its own pace. Because this Pokémon eats and sleeps whenever it decides, its daily routines are completely random.; The reason it does not have a nest is that it simply searches for a clean, comfortable place then sleeps there.; Rather than keeping a permanent lair, it habitually seeks comfortable spots and sleeps there. It is nocturnal and becomes active at dusk.; The favorite of trend conscious female Trainers, they are used in competition for their style and fur.; It dislikes dirty places. It often searches for a comfortable place in which to groom itself."
Sableye,302,"Sableye: id: 302 - nickname: Darkness Pokémon - type: dark and ghost - height: 0.5 - weight: 11.0; descriptions: Sableye lead quiet lives deep inside caverns. They are feared, however, because these Pokémon are thought to steal the spirits of people when their eyes burn with a sinister glow in the darkness.; It digs branching holes in caves using its sharp claws in search of food raw gems. A Sableye lurks in darkness and is seen only rarely.; Materials from gems it has eaten float to the surface of its body and can form an infinite number of patterns among individuals.; Sableye digs the ground with sharpened claws to find rocks that it eats. Substances in the eaten rocks crystallize and rise up to the Pokémon's body surface.; This Pokémon is feared. When its gemstone eyes begin to glow with a sinister shine, it's believed that Sableye will steal people's spirits away.; It's a fiend for gemstones, so it stalks Carbink. Unfortunately, Gabite almost always grabs them first.; It digs through the ground with its hard claws and crunches down gems with its thick pointy teeth. Carbink is its favorite food.; It feeds on gemstone crystals. In darkness, its eyes sparkle with the glitter of jewels.; It dwells in the darkness of caves. It uses its sharp claws to dig up gems to nourish itself.; It hides in the darkness of caves. Its diet of gems has transformed its eyes into gemstones."
Mawile,303,"Mawile: id: 303 - nickname: Deceiver Pokémon - type: steel and fairy - height: 0.6 - weight: 11.5; descriptions: It chomps with its gaping mouth. Its huge jaws are actually steel horns that have been transformed.; Don't be taken in by this Pokémon's cute face it's very dangerous. Mawile fools the foe into letting down its guard, then chomps down with its massive jaws. The steel jaws are really horns that have been transformed.; Mawile's huge jaws are actually steel horns that have been transformed. Its docile looking face serves to lull its foe into letting down its guard. When the foe least expects it, Mawile chomps it with its gaping jaws.; Mawhile's huge jaws are actually steel horns that have been transformed. Its docile looking face serves to lull its foe into letting down its guard. When the foe least expects it, Mawhile chomps it with its gaping jaws.; It uses its docile looking face to lull foes into complacency, then bites with its huge, relentless jaws.; A cunning and terrifying Pokémon, its cuteness makes opponents let down their guard and then it swallows them whole with its huge jaws.; Its giant jaws are actually steel horns that transformed. It fools foes into complacency with its adorable gestures, then chomps them with its huge jaws.; It has two mouths. The big jaws on the back of its head can't taste anything, so that's the mouth it uses to eat foods it doesn't like.; Attached to its head is a huge set of jaws formed by horns. It can chew through iron beams."
Aron,304,"Aron: id: 304 - nickname: Iron Armor Pokémon - type: steel and rock - height: 0.4 - weight: 60.0; descriptions: In order to build up its steel body, it eats iron ore. This pesky Pokémon is known to eat railroad tracks.; Aron has a body of steel. With one all out charge, this Pokémon can demolish even a heavy dump truck. The destroyed dump truck then becomes a handy meal for the Pokémon.; When Aron evolves, its steel armor peels off. In ancient times, people would collect Aron's shed armor and make good use of it in their daily lives.; This Pokémon has a body of steel. To make its body, Aron feeds on iron ore that it digs from mountains. Occasionally, it causes major trouble by eating bridges and rails.; It usually lives deep in mountains. However, hunger may drive it to eat railroad tracks and cars.; It eats iron to build its steel body. It is a pest that descends from mountains to eat bridges and train tracks.; When it evolves, it sheds the steel carapace that covered its whole body and develops a new one.; It eats iron ore and sometimes railroad tracks to build up the steel armor that protects its body.; A Pokémon that is clad in steel armor. A new suit of armor is made when it evolves. The old, discarded armor is salvaged as metal for making iron products."
Lairon,305,"Lairon: id: 305 - nickname: Iron Armor Pokémon - type: steel and rock - height: 0.9 - weight: 120.0; descriptions: Lairon tempers its steel body by drinking highly nutritious mineral springwater until it is bloated. This Pokémon makes its nest close to springs of delicious water.; When two Lairon meet in the wild, they fight for territory by bashing into each other with their steel bodies. The sound of their collision carries for miles.; It loves iron ore. Groups of them fight for territory by bashing one another with their steel bodies.; During territorial disputes, Lairon fight by slamming into each other. Close inspection of their steel armor reveals scratches and dents.; It habitually shows off its strength with the size of sparks it creates by ramming its steel body into boulders.; Lairon live in mountains brimming with spring water and iron ore, so these Pokémon often came into conflict with humans in the past.; Lairon feeds on iron contained in rocks and water. It makes its nest on mountains where iron ore is buried. As a result, the Pokémon often clashes with humans mining the iron ore.; For food, it digs up iron ore. It smashes its steely body against others to fight over territory.; Lairon fight over territory, and when their steel bodies collide, sparks fly."
Aggron,306,"Aggron: id: 306 - nickname: Iron Armor Pokémon - type: steel and rock - height: 2.1 - weight: 360.0; descriptions: Aggron is surprisingly protective of its environment. If its mountain is ravaged by a landslide or a fire, this Pokémon will haul topsoil to the area, plant trees, and beautifully restore its own territory.; Long ago, there was a king who wore a helmet meant to resemble the head of an Aggron. He was trying to channel the Pokémon's strength.; While seeking iron for food, it digs tunnels by breaking through bedrock with its steel horns.; Aggron claims an entire mountain as its own territory. It mercilessly beats up anything that violates its environment. This Pokémon vigilantly patrols its territory at all times.; It claims a large mountain as its sole territory. It mercilessly thrashes those that violate its space.; Aggron has a horn sharp enough to perforate thick iron sheets. It brings down its opponents by ramming into them horn first.; Its iron horns grow longer a little at a time. They are used to determine the Aggron's age. The gouges in its armor are worn with pride as mementos from battles.; Aggron is protective of its environment. If its mountain is ravaged by a landslide or a fire, this Pokémon will haul topsoil to the area, plant trees, and beautifully restore its own territory.; It claims an entire mountain as its own. The more wounds it has, the more it has battled, so don't take it lightly.; You can tell its age by the length of its iron horns. It claims an entire mountain as its territory."
Meditite,307,"Meditite: id: 307 - nickname: Meditate Pokémon - type: fighting and psychic - height: 0.6 - weight: 11.2; descriptions: It meditates to heighten its inner energy and to float in the air. It eats one berry a day.; It never misses its daily yoga workouts, and it heightens its spiritual power through meditation.; It eats just one berry a day. By enduring hunger, its spirit is tempered and made sharper.; Meditite undertakes rigorous mental training deep in the mountains. However, whenever it meditates, this Pokémon always loses its concentration and focus. As a result, its training never ends.; It always trains deep in mountains. It levitates when it heightens its spiritual power through meditation.; Meditite heightens its inner energy through meditation. It survives on just one berry a day. Minimal eating is another aspect of this Pokémon's training.; It continually meditates for hours every day. As a result of rigorous and dedicated yoga training, it has tempered its spiritual power so much it can fly.; It never skips its daily yoga training. It heightens its inner strength through meditation."
Medicham,308,"Medicham: id: 308 - nickname: Meditate Pokémon - type: fighting and psychic - height: 1.3 - weight: 31.5; descriptions: It elegantly avoids attacks with dance like steps, then launches a devastating blow in the same motion.; It is said that through meditation, Medicham heightens energy inside its body and sharpens its sixth sense. This Pokémon hides its presence by merging itself with fields and mountains.; Through the power of meditation, Medicham developed its sixth sense. It gained the ability to use psychokinetic powers. This Pokémon is known to meditate for a whole month without eating.; Through yoga training, it gained the psychic power to predict its foe's next move.; Through daily meditation, it hones its spiritual power. It can sense what others are thinking.; Through yoga training, it has honed its sixth sense. Its movements are elegant.; Through crushingly harsh yoga training, it gained the power to foretell its foe's actions. It battles with elegant, dance like movement.; It gains the ability to see the aura of its opponents by honing its mind through starvation."
Electrike,309,"Electrike: id: 309 - nickname: Lightning Pokémon - type: electric - height: 0.6 - weight: 15.2; descriptions: Electrike runs faster than the human eye can follow. The friction from running is converted into electricity, which is then stored in this Pokémon's fur.; It stores static electricity in its fur for discharging. It gives off sparks if a storm approaches.; Static electricity builds up all over its body as strands of its long fur rub together. This Pokémon boasts incredible speed.; Electrike stores electricity in its long body hair. This Pokémon stimulates its leg muscles with electric charges. These jolts of power give its legs explosive acceleration performance.; It stores electricity in its fur. It gives off sparks from all over its body in seasons when the air is dry.; It generates electricity using friction from the atmosphere. In seasons with especially arid air, its entire body blazes with violent showers of sparks.; Using electricity stored in its fur, it stimulates its muscles to heighten its reaction speed.; Friction between the air and its fur produces static electricity. When Electrike runs, it makes a crackling sound."
Manectric,310,"Manectric: id: 310 - nickname: Discharge Pokémon - type: electric - height: 1.5 - weight: 40.2; descriptions: It rarely appears before people. It is said to nest where lightning has fallen.; Manectric can be found beneath unnatural thunderclouds. People say it can run at the same speed as lightning striking.; Manectric is constantly discharging electricity from its mane. The sparks sometimes ignite forest fires. When it enters a battle, this Pokémon creates thunderclouds.; Manectric discharges strong electricity from its mane. The mane is used for collecting electricity in the atmosphere. This Pokémon creates thunderclouds above its head.; Because lightning falls in their vicinities, Manectric were thought to have been born from lightning. In battle, they create thunderclouds.; Its nest can be found where a thunderbolt hits. It is discharging electricity from its mane.; It discharges electricity from its mane. It creates a thundercloud overhead to drop lightning bolts.; It stimulates its own muscles with electricity, so it can move quickly. It eases its soreness with electricity, too, so it can recover quickly as well."
Plusle,311,"Plusle: id: 311 - nickname: Cheering Pokémon - type: electric - height: 0.4 - weight: 4.2; descriptions: Plusle always acts as a cheerleader for its partners. Whenever a teammate puts out a good effort in battle, this Pokémon shorts out its body to create the crackling noises of sparks to show its joy.; When Plusle is cheering on its partner, it flashes with electric sparks from all over its body. If its partner loses, this Pokémon cries loudly.; It has the trait of cheering on its fellow Pokémon. By shorting out the electricity it releases from its paws, it creates pom poms for cheering.; It absorbs electricity from telephone poles. It shorts out its body to create crackling noises.; It cheers on friends with pom poms made of sparks. It drains power from telephone poles.; It cheers on partners while scattering sparks from its body. It climbs telephone poles to absorb electricity."
Minun,312,"Minun: id: 312 - nickname: Cheering Pokémon - type: electric - height: 0.4 - weight: 4.2; descriptions: At a meeting of Pokémon academics, it was announced that simultaneous exposure to electricity from a Plusle and Minun will promote circulation and boost vitality.; Minun loves to cheer on its partner in battle. It gives off sparks from its body while it is doing so. If its partner is in trouble, this Pokémon gives off increasing amounts of sparks.; It cheers on friends. If its friends are losing, its body lets off more and more sparks.; Exposure to electricity from Minun and Plusle promotes blood circulation and relaxes muscles.; Minun is more concerned about cheering on its partners than its own safety. It shorts out the electricity in its body to create brilliant showers of sparks to cheer on its teammates.; Its dislike of water makes it take shelter under the eaves of houses in rain. It uses pom poms made of sparks for cheering."
Volbeat,313,"Volbeat: id: 313 - nickname: Firefly Pokémon - type: bug - height: 0.7 - weight: 17.7; descriptions: It communicates with others by lighting up its rear at night. It loves Illumise's sweet aroma.; With the arrival of night, Volbeat emits light from its tail. It communicates with others by adjusting the intensity and flashing of its light. This Pokémon is attracted by the sweet aroma of Illumise.; It lives around clean ponds. At night, its rear lights up. It converses with others by flashing its light.; It emits light from its tail to communicate. It loves the sweet aroma given off by Illumise.; Volbeat's tail glows like a lightbulb. With other Volbeat, it uses its tail to draw geometric shapes in the night sky. This Pokémon loves the sweet aroma given off by Illumise.; With their taillights lit, Volbeat fly in a swarm, drawing geometric designs in the night sky. They move their nests if their pond water becomes dirty."
Illumise,314,"Illumise: id: 314 - nickname: Firefly Pokémon - type: bug - height: 0.6 - weight: 17.7; descriptions: Illumise leads a flight of illuminated Volbeat to draw signs in the night sky. This Pokémon is said to earn greater respect from its peers by composing more complex designs in the sky.; Illumise attracts a swarm of Volbeat using a sweet fragrance. Once the Volbeat have gathered, this Pokémon leads the lit up swarm in drawing geometric designs on the canvas of the night sky.; It guides Volbeat to draw signs in night skies. There are scientists that study the patterns it creates.; A nocturnal Pokémon that becomes active upon nightfall. It leads a Volbeat swarm to draw patterns in the night sky. Over 200 different patterns have been confirmed.; With its sweet aroma, it guides Volbeat to draw signs with light in the night sky.; Its fragrance attracts a swarm of Volbeat, so they draw over 200 patterns in the night sky."
Roselia,315,"Roselia: id: 315 - nickname: Thorn Pokémon - type: grass and poison - height: 0.3 - weight: 2.0; descriptions: Roselia that drink nutritionally rich springwater are said to reveal rare coloration when they bloom.; Its flowers give off a relaxing fragrance. The stronger its aroma, the healthier the Roselia is.; The more healthy the Roselia, the more pleasant its flowers' aroma. Its scent deeply relaxes people.; It uses the different poisons in each hand separately when it attacks. The stronger its aroma, the healthier it is.; On extremely rare occasions, a Roselia is said to appear with its flowers in unusual colors. The thorns on this Pokémon's head contain a vicious poison.; Roselia shoots sharp thorns as projectiles at any opponent that tries to steal the flowers on its arms. The aroma of this Pokémon brings serenity to living things.; A Roselia that drinks nutritionally rich springwater blooms with lovely flowers. The fragrance of its flowers has the effect of making its foes careless.; Roselia raised on clean drinking water are known to grow vividly colored flowers.; The beautiful flowers on its arms have toxic thorns. Don't even think about picking those flowers.; Though beautiful, it has highly poisonous thorns. There is an old tradition in my homeland wherein one would send these thorns to an opponent to challenge them to a duel."
Gulpin,316,"Gulpin: id: 316 - nickname: Stomach Pokémon - type: poison - height: 0.4 - weight: 10.3; descriptions: There is nothing its stomach can't digest. While it is digesting, vile, overpowering gases are expelled.; Virtually all of Gulpin's body is its stomach. As a result, it can swallow something its own size. This Pokémon's stomach contains a special fluid that digests anything.; Most of Gulpin's body is made up of its stomach its heart and brain are very small in comparison. This Pokémon's stomach contains special enzymes that dissolve anything.; It has a small heart and brain. Its stomach comprises most of its body, with enzymes to dissolve anything.; Almost all its body is its stomach. Its harsh digestive juices quickly dissolve anything it swallows.; This Pokémon's stomach fluid can even digest scrap iron. In one gulp, it can swallow something that is as large as itself."
Swalot,317,"Swalot: id: 317 - nickname: Poison Bag Pokémon - type: poison - height: 1.7 - weight: 80.0; descriptions: When Swalot spots prey, it spurts out a hideously toxic fluid from its pores and sprays the target. Once the prey has weakened, this Pokémon gulps it down whole with its cavernous mouth.; It gulps anything that fits in its mouth. Its special enzymes can dissolve anything.; It swallows anything whole. It sweats toxic fluids from its follicles to douse foes.; Its powerful stomach acid is capable of digesting almost anything. The one thing in the whole world a Swalot can't digest is its own stomach.; It can swallow a tire whole in one gulp. It secretes a horribly toxic fluid from the pores on its body.; Swalot has no teeth, so what it eats, it swallows whole, no matter what. Its cavernous mouth yawns widely. An automobile tire could easily fit inside this Pokémon's mouth."
Carvanha,318,"Carvanha: id: 318 - nickname: Savage Pokémon - type: water and dark - height: 0.8 - weight: 20.8; descriptions: Carvanha attack ships in swarms, making them sink. Although it is said to be a very vicious Pokémon, it timidly flees as soon as it finds itself alone.; They're such cowards that they won't hunt alone. When five or so of them get together, they suddenly turn ferocious; They form packs to attack boats and rip out their hulls to sink them. They live in rivers in the jungle.; It won't attack while it's alone not even if it spots prey. Instead, it waits for other Carvanha to join it, and then the Pokémon attack as a group.; Carvanha's strongly developed jaws and its sharply pointed fangs pack the destructive power to rip out boat hulls. Many boats have been attacked and sunk by this Pokémon.; If anything invades Carvanha's territory, it will swarm and tear at the intruder with its pointed fangs. On its own, however, this Pokémon turns suddenly timid.; These Pokémon have sharp fangs and powerful jaws. Sailors avoid Carvanha dens at all costs.; If they scent the faintest trace of blood, they rush to attack en masse. When alone, they're rather cowardly.; Each school has its own territory. Any intruders are mercilessly attacked with fangs bared.; With its sturdy jaws and fangs, it can easily chomp wooden boats to splinters. It fights with Basculin over food.; They swarm any foe that invades their territory. Their sharp fangs can tear out boat hulls.; It lives in massive rivers that course through jungles. It swarms prey that enter its territory."
Sharpedo,319,"Sharpedo: id: 319 - nickname: Brutal Pokémon - type: water and dark - height: 1.8 - weight: 88.8; descriptions: It drinks in seawater and jets it from its rear to propel itself. It's very sensitive to the scent of blood.; Its fangs rip through sheet iron. It swims at 75 mph and is known as The Bully of the Sea.; It pursues its prey at speeds of 75 mph and finishes them off with fangs that can crush iron. It is known as the bully of the sea.; It has a sad history. In the past, its dorsal fin was a treasured foodstuff, so this Pokémon became a victim of overfishing.; Nicknamed the bully of the sea, Sharpedo is widely feared. Its cruel fangs grow back immediately if they snap off. Just one of these Pokémon can thoroughly tear apart a supertanker.; The vicious and sly gangster of the sea. Its skin is specially textured to minimize drag in water. Its speed tops out at over 75 miles per hour.; Sharpedo can swim at speeds of up to 75 mph by jetting seawater out of its backside. This Pokémon's drawback is its inability to swim long distances.; As soon as it catches the scent of prey, Sharpedo will jet seawater from its backside, hurtling toward the target to attack at 75 mph.; People believe that carrying one of its discarded fangs will prevent mishaps at sea, so the fangs are made into accessories.; It can swim at speeds of 75 mph by jetting seawater through its body. It is the bandit of the sea.; This Pokémon is known as the Bully of the Sea. Any ship entering the waters Sharpedo calls home will be attacked no exceptions.; The ruffian of the seas, it has fangs that crunch through iron. It swims by jetting water from its rear."
