name,id,all_cleaned
Bulbasaur,1,"Bulbasaur: id: 1 - nickname: Seed Pokémon - type: grass and poison - height: 0.7 - weight: 6.9; descriptions: While it is young, it uses the nutrients that are stored in the seeds on its back in order to grow.; There is a plant seed on its back right from the day this Pokémon is born. The seed slowly grows larger.; A strange seed was planted on its back at birth. The plant sprouts and grows with this Pokémon.; It can go for days without eating a single morsel. In the bulb on its back, it stores energy.; The seed on its back is filled with nutrients. The seed grows steadily larger as its body grows.; It carries a seed on its back right from birth. As it grows older, the seed also grows larger.; For some time after its birth, it grows by gaining nourishment from the seed on its back.; While it is young, it uses the nutrients that are stored in the seed on its back in order to grow.; Bulbasaur can be seen napping in bright sunlight. There is a seed on its back. By soaking up the sun's rays, the seed grows progressively larger."
Ivysaur,2,"Ivysaur: id: 2 - nickname: Seed Pokémon - type: grass and poison - height: 1.0 - weight: 13.0; descriptions: The bulb on its back grows by drawing energy. It gives off an aroma when it is ready to bloom.; If the bud on its back starts to smell sweet, it is evidence that the large flower will soon bloom.; There is a bud on this Pokémon's back. To support its weight, Ivysaur's legs and trunk grow thick and strong. If it starts spending more time lying in the sunlight, it's a sign that the bud will bloom into a large flower soon.; To support its bulb, Ivysaur's legs grow sturdy. If it spends more time lying in the sunlight, the bud will soon bloom into a large flower.; The bud on its back grows by drawing energy. It gives off an aroma when it is ready to bloom.; When the bud on its back starts swelling, a sweet aroma wafts to indicate the flower's coming bloom.; The bulb on its back grows as it absorbs nutrients. The bulb gives off a pleasant aroma when it blooms.; There is a plant bulb on its back. When it absorbs nutrients, the bulb is said to blossom into a large flower.; Exposure to sunlight adds to its strength. Sunlight also makes the bud on its back grow larger.; When the bulb on its back grows large, it appears to lose the ability to stand on its hind legs."
Venusaur,3,"Venusaur: id: 3 - nickname: Seed Pokémon - type: grass and poison - height: 2.0 - weight: 100.0; descriptions: Its plant blooms when it is absorbing solar energy. It stays on the move to seek sunlight.; There is a large flower on Venusaur's back. The flower is said to take on vivid colors if it gets plenty of nutrition and sunlight. The flower's aroma soothes the emotions of people.; It is able to con vert sunlight into energy. As a result, it is more powerful in the summertime.; Venusaur's flower is said to take on vivid colors if it gets plenty of nutrition and sunlight. The flower's aroma soothes the emotions of people.; The plant blooms when it is absorbing solar energy. It stays on the move to seek sunlight.; By spreading the broad petals of its flower and catching the sun's rays, it fills its body with power.; As it warms it self and absorbs the sunlight, its flower petals release a pleasant fragrance.; A bewitching aroma wafts from its flower. The fragrance becalms those engaged in a battle.; After a rainy day, the flower on its back smells stronger. The scent attracts other Pokémon.; The flower on its back catches the sun's rays. The sunlight is then absorbed and used for energy."
Charmander,4,"Charmander: id: 4 - nickname: Lizard Pokémon - type: fire - height: 0.6 - weight: 8.5; descriptions: The fire on the tip of its tail is a measure of its life. If healthy, its tail burns intensely.; The flame on its tail shows the strength of its life force. If it is weak, the flame also burns weakly.; The flame on its tail indicates Charmander's life force. If it is healthy, the flame burns brightly.; The flame that burns at the tip of its tail is an indication of its emotions. The flame wavers when Charmander is enjoying itself. If the Pokémon becomes enraged, the flame burns fiercely.; The flame that burns at the tip of its tail is an indication of its emotions. The flame wavers when Charmander is happy, and blazes when it is enraged.; Obviously prefers hot places. When it rains, steam is said to spout from the tip of its tail.; If it's healthy, the flame on the tip of its tail will burn vigor ously, even if it gets a bit wet.; It has a preference for hot things. When it rains, steam is said to spout from the tip of its tail.; The flame at the tip of its tail makes a sound as it burns. You can only hear it in quiet places.; From the time it is born, a flame burns at the tip of its tail. Its life would end if the flame were to go out."
Charmeleon,5,"Charmeleon: id: 5 - nickname: Flame Pokémon - type: fire - height: 1.1 - weight: 19.0; descriptions: It is very hot headed by nature, so it constantly seeks opponents. It calms down only when it wins.; If it becomes agitated during battle, it spouts intense flames, incinerating its surroundings.; When it swings its burning tail, it elevates the air temperature to unbearably high levels.; Charmeleon mercilessly destroys its foes using its sharp claws. If it encounters a strong foe, it turns aggressive. In this excited state, the flame at the tip of its tail flares with a bluish white color.; In the rocky mountains where Charmeleon live, their fiery tails shine at night like stars.; Tough fights could excite this Pokémon. When excited, it may blow out bluish white flames.; It has a barbaric nature. In battle, it whips its fiery tail around and slashes away with sharp claws.; Tough fights could excite this Pokémon. When excited, it may breathe out bluish white flames.; Without pity, its sharp claws destroy foes. If it encounters a strong enemy, it becomes agitated, and the flame on its tail flares with a bluish white color.; It lashes about with its tail to knock down its foe. It then tears up the fallen opponent with sharp claws.; When it swings its burning tail, it elevates the temperature to unbearably high levels."
Charizard,6,"Charizard: id: 6 - nickname: Flame Pokémon - type: fire and flying - height: 1.7 - weight: 90.5; descriptions: When this Pokémon expels a blast of superhot fire, the red flame at the tip of its tail burns more intensely.; When expelling a blast of superhot fire, the red flame at the tip of its tail burns more intensely.; A Charizard flies about in search of strong opponents. It breathes intense flames that can melt any material. However, it will never torch a weaker foe.; Charizard flies around the sky in search of powerful opponents. It breathes fire of such great heat that it melts anything. However, it never turns its fiery breath on any opponent weaker than itself.; Spits fire that is hot enough to melt boulders. Known to cause forest fires unintentionally.; It spits fire that is hot enough to melt boulders. It may cause forest fires by blowing flames.; If Charizard becomes furious, the flame at the tip of its tail flares up in a light blue shade.; Its wings can carry this Pokémon close to an altitude of 4,600 feet. It blows out fire at very high temperatures.; Breathing intense, hot flames, it can melt almost any thing. Its breath inflicts terrible pain on enemies.; It uses its wings to fly high. The temperature of its fire increases as it gains exper ience in battle.; It is said that Charizard's fire burns hotter if it has experienced harsh battles.; If Charizard be comes furious, the flame at the tip of its tail flares up in a whitish blue color."
Squirtle,7,"Squirtle: id: 7 - nickname: Tiny Turtle Pokémon - type: water - height: 0.5 - weight: 9.0; descriptions: It shelters itself in its shell, then strikes back with spouts of water at every opportunity.; When it retracts its long neck into its shell, it squirts out water with vigorous force.; Its shell is not just for protection. Its rounded shape and the grooves on its surface minimize resistance in water, enabling Squirtle to swim at high speeds.; When it feels threatened, it draws its legs inside its shell and sprays water from its mouth.; The shell, which hardens soon after it is born, is resilient. If you poke it, it will bounce back out.; Squirtle's shell is not merely used for protection. The shell's rounded shape and the grooves on its surface help minimize resistance in water, enabling this Pokémon to swim at high speeds.; The shell is soft when it is born. It soon becomes so resilient, prod ding fingers will bounce off it.; After birth, its back swells and hardens into a shell. It powerfully sprays foam from its mouth.; When it feels threatened, it draws its limbs inside its shell and sprays water from its mouth.; After birth, its back swells and hardens into a shell. Powerfully sprays foam from its mouth.; Shoots water at prey while in the water. Withdraws into its shell when in danger."
Wartortle,8,"Wartortle: id: 8 - nickname: Turtle Pokémon - type: water - height: 1.0 - weight: 22.5; descriptions: Its long, furry tail is a symbol of longevity, making it quite popular among older people.; It is said to live 10,000 years. Its furry tail is popular as a symbol of longevity.; When tapped, this Pokémon will pull in its head, but its tail will still stick out a little bit.; It often hides in water to stalk unwary prey. For fast swimming, it moves its ears to maintain balance.; It is a well established symbol of longevity. If its shell has algae on it, that Wartortle is very old.; Its tail is large and covered with a rich, thick fur. The tail becomes increasingly deeper in color as Wartortle ages. The scratches on its shell are evidence of this Pokémon's toughness as a battler.; It cleverly con trols its furry ears and tail to maintain its balance while swimming.; Often hides in water to stalk unwary prey. For swimming fast, it moves its ears to maintain balance.; This Pokémon is very popular as a pet. Its fur covered tail is a symbol of its longevity.; It is recognized as a symbol of longevity. If its shell has algae on it, that Wartortle is very old.; Its large tail is covered with rich, thick fur that deepens in color with age. The scratches on its shell are evidence of this Pokémon's toughness in battle.; When tapped on its head, this Pokémon will pull it in, but its tail will still stick out a little bit."
Blastoise,9,"Blastoise: id: 9 - nickname: Shellfish Pokémon - type: water - height: 1.6 - weight: 85.5; descriptions: It firmly plants its feet on the ground before shooting water from the jets on its back.; The waterspouts that protrude from its shell are highly accurate. Their bullets of water can precisely nail tin cans from a distance of over 160 feet.; Once it takes aim at its enemy, it blasts out water with even more force than a fire hose.; The pressurized water jets on this brutal Pokémon's shell are used for high speed tackles.; It deliberately makes itself heavy so it can withstand the recoil of the water jets it fires.; Blastoise has water spouts that protrude from its shell. The water spouts are very accurate. They can shoot bullets of water with enough accuracy to strike empty cans from a distance of over 160 feet.; A brutal Pokémon with pressurized water jets on its shell. They are used for high speed tackles.; It crushes its foe under its heavy body to cause fainting. In a pinch, it will withdraw inside its shell.; The rocket cannons on its shell fire jets of water capable of punch ing holes through thick steel.; The jets of water it spouts from the rocket cannons on its shell can punch through thick steel."
Caterpie,10,"Caterpie: id: 10 - nickname: Worm Pokémon - type: bug - height: 0.3 - weight: 2.9; descriptions: For protection, it releases a horri ble stench from the antenna on its head to drive away enemies.; Its feet have suction cups designed to stick to any surface. It tenaciously climbs trees to forage.; Its short feet are tipped with suction pads that enable it to tirelessly climb slopes and walls.; For protection, it releases a horrible stench from the antennae on its head to drive away enemies.; It crawls into foliage where it camouflages itself among leaves that are the same color as its body.; It is covered with a green skin. When it grows, it sheds the skin, covers itself with silk, and becomes a cocoon.; If you touch the feeler on top of its head, it will release a horrible stink to protect itself.; When attacked by bird Pokémon, it resists by releasing a terrifically strong odor from its antennae, but it often becomes their prey.; Its body is soft and weak. In nature, its perpetual fate is to be seen by others as food.; It's easy to catch, and it grows quickly, making it one of the top recommendations for novice Pokémon Trainers.; It releases a stench from its red antenna to repel enemies. It grows by molting repeatedly.; Caterpie has a voracious appetite. It can devour leaves bigger than its body right before your eyes. From its antenna, this Pokémon releases a terrifically strong odor.; Its voracious appetite compels it to devour leaves bigger than itself without hesitation. It releases a terribly strong odor from its antennae.; Perhaps because it would like to grow up quickly, it has a voracious appetite, eating a hundred leaves a day."
Metapod,11,"Metapod: id: 11 - nickname: Cocoon Pokémon - type: bug - height: 0.7 - weight: 9.9; descriptions: A steel hard shell protects its tender body. It quietly endures hardships while awaiting evolution.; Inside the shell, it is soft and weak as it pre pares to evolve. It stays motion less in the shell.; Hardens its shell to protect itself. However, a large impact may cause it to pop out of its shell.; Its shell is as hard as an iron slab. A Metapod does not move very much because it is preparing its soft innards for evolution inside the shell.; It prepares for evolution by hardening its shell as much as possible to protect its soft body.; The shell covering this Pokémon's body is as hard as an iron slab. Metapod does not move very much. It stays still because it is preparing its soft innards for evolution inside the hard shell.; Its shell is hard, but it's still just a bug shell. It's been known to break, so intense battles with it should be avoided.; Its shell is filled with a thick liquid. All of the cells throughout its body are being rebuilt in preparation for evolution.; Its hard shell doesn't crack a bit even if Pikipek pecks at it, but it will tip over, spilling out its insides.; It is waiting for the moment to evolve. At this stage, it can only harden, so it remains motionless to avoid attack.; This Pokémon is vulnerable to attack while its shell is soft, exposing its weak and tender body.; Its shell is filled with its soft innards. It doesn't move much because of the risk it might carelessly spill its innards out.; This is its pre evolved form. At this stage, it can only harden, so it remains motionless to avoid attack.; Even though it is encased in a sturdy shell, the body inside is tender. It can't withstand a harsh attack."
Butterfree,12,"Butterfree: id: 12 - nickname: Butterfly Pokémon - type: bug and flying - height: 1.1 - weight: 32.0; descriptions: Water repellent powder on its wings enables it to collect honey, even in the heaviest of rains.; It loves the honey of flowers and can locate flower patches that have even tiny amounts of pollen.; It collects honey every day. It rubs honey onto the hairs on its legs to carry it back to its nest.; In battle, it flaps its wings at high speed to release highly toxic dust into the air.; It has a superior ability to search for delicious honey from flowers. It can seek, extract, and carry honey from flowers blooming over six miles away.; Butterfree has a superior ability to search for delicious honey from flowers. It can even search out, extract, and carry honey from flowers that are blooming over six miles from its nest.; When attacked by other Pokémon, it defends itself by scattering its poisonous scales and fluttering its wings.; In battle, it flaps its wings at great speed to release highly toxic dust into the air.; It flits from flower to flower, collecting honey. It can even identify distant flowers in bloom.; Its wings are covered in toxic scales. If it finds bird Pokémon going after Caterpie, Butterfree sprinkles its scales on them to drive them off.; The wings are protected by rain repellent dust. As a result, this Pokémon can fly about even in rain.; Its wings, covered with poisonous powders, repel water. This allows it to fly in the rain.; Its wings, covered with poisonous powder, repel water. This allows it to fly in the rain.; Nectar from pretty flowers is its favorite food. In fields of flowers, it has heated battles with Cutiefly for territory.; Close examination of its large eyes reveals that each eye is composed of a myriad of tiny eyes."
Weedle,13,"Weedle: id: 13 - nickname: Hairy Bug Pokémon - type: bug and poison - height: 0.3 - weight: 3.2; descriptions: Weedle has an extremely acute sense of smell. It is capable of distinguishing its favorite kinds of leaves from those it dislikes just by sniffing with its big red proboscis nose .; It attacks using a two inch poison barb on its head. It can usually be found under the leaves it eats.; Often found in forests, eating leaves. It has a sharp venomous stinger on its head.; The barb on top of its head secretes a strong poison. It uses this toxic barb to protect itself.; Often found in forests and grasslands. It has a sharp, toxic barb of around two inches on top of its head.; Beware of the sharp stinger on its head. It hides in grass and bushes where it eats leaves.; Its poison stinger is very powerful. Its bright colored body is intended to warn off its enemies.; A Weedle has an extremely acute sense of smell. It distinguishes its favorite kinds of leaves from those it dislikes by sniffing with its big red proboscis nose .; Often found in forests, eating leaves. It has a sharp stinger on its head that injects poison.; It eats its weight in leaves every day. It fends off attackers with the needle on its head."
Kakuna,14,"Kakuna: id: 14 - nickname: Cocoon Pokémon - type: bug and poison - height: 0.6 - weight: 10.0; descriptions: Able to move only slightly. When endangered, it may stick out its stinger and poison its enemy.; Almost incapable of moving, this Pokémon can only harden its shell to protect itself when it is in danger.; This Pokémon is in a temporary stage while making its body. It is almost completely unable to move on its own.; Kakuna remains virtually immobile as it clings to a tree. However, on the inside, it is extremely busy as it prepares for its coming evolution. This is evident from how hot the shell becomes to the touch.; Almost incapable of moving, this Pokémon can only harden its shell to protect itself from predators.; Although it is a cocoon, it can move a little. It can extend its poison barb if it is attacked.; It remains virtually immobile while it clings to a tree. However, on the inside, it busily prepares for evolution. This is evident from how hot its shell becomes.; Nearly incapable of movement, it leans against stout trees while waiting for its evolution.; From this form, it will grow into an adult. As its body becomes softer, the external shell hardens.; While awaiting evolution, it hides from predators under leaves and in nooks of branches."
Beedrill,15,"Beedrill: id: 15 - nickname: Poison Bee Pokémon - type: bug and poison - height: 1.0 - weight: 29.5; descriptions: It can take down any opponent with its powerful poison stingers. It sometimes attacks in swarms.; It flies at high speed and attacks using the large venomous stingers on its forelegs and tail.; It has 3 poisonous stingers on its forelegs and its tail. They are used to jab its enemy repeatedly.; May appear in a swarm. Flies at violent speeds, all the while stabbing with the toxic stinger on its rear.; It has three poison barbs. The barb on its tail secretes the most powerful poison.; It has three poisonous stingers on its forelegs and its tail. They are used to jab its enemy repeatedly.; Beedrill is extremely territorial. No one should ever approach its nest this is for their own safety. If angered, they will attack in a furious swarm.; Its best attack involves flying around at high speed, striking with poison needles, then flying off.; It uses sharp, poisonous stings to defeat prey, then takes the victim back to its nest for food.; Flies at high speed and attacks using its large venomous stingers on its forelegs and tail.; A Beedrill is extremely territorial. For safety reasons, no one should ever approach its nest. If angered, they will attack in a swarm."
Pidgey,16,"Pidgey: id: 16 - nickname: Tiny Bird Pokémon - type: normal and flying - height: 0.3 - weight: 1.8; descriptions: Very docile. If attacked, it will often kick up sand to protect itself rather than fight back.; It is docile and prefers to avoid conflict. If disturbed, however, it can ferociously strike back.; It usually hides in tall grass. Be cause it dislikes fighting, it pro tects itself by kicking up sand.; A common sight in forests and woods. It flaps its wings at ground level to kick up blinding sand.; It rapidly flaps its wings in the grass, stirring up a dust cloud that drives insect prey out into the open.; Pidgey has an extremely sharp sense of direction. It is capable of unerringly returning home to its nest, however far it may be removed from its familiar surroundings.; Common in grassy areas and forests, it is very docile and will chase off enemies by flap ping up sand.; It has an extremely sharp sense of direction. It can unerringly return home to its nest, however far it may be removed from its familiar surroundings.; Does not like to fight. It hides in tall grass and so on, foraging for food such as small bugs."
Pidgeotto,17,"Pidgeotto: id: 17 - nickname: Bird Pokémon - type: normal and flying - height: 1.1 - weight: 30.0; descriptions: Pidgeotto claims a large area as its own territory. This Pokémon flies around, patrolling its living space. If its territory is violated, it shows no mercy in thoroughly punishing the foe with its sharp claws.; This Pokémon is full of vitality. It constantly flies around its large territory in search of prey.; The claws on its feet are well developed. It can carry prey such as an Exeggcute to its nest over 60 miles away.; It immobilizes its prey using well developed claws, then carries the prey more than 60 miles to its nest.; It renders its prey immobile using well developed claws, then carries the prey more than 60 miles to its nest.; Very protective of its sprawling territorial area, this Pokémon will fiercely peck at any intruder.; This Pokémon flies around, patrolling its large territory. If its living space is violated, it shows no mercy in thoroughly punishing the foe with its sharp claws.; It slowly flies in a circular pat tern, all the while keeping a sharp lookout for prey.; It has outstanding vision. However high it flies, it is able to distin guish the move ments of its prey.; It flies over its wide territory in search of prey, downing it with its highly developed claws."
Pidgeot,18,"Pidgeot: id: 18 - nickname: Bird Pokémon - type: normal and flying - height: 1.5 - weight: 39.5; descriptions: This Pokémon flies at Mach 2 speed, seeking prey. Its large talons are feared as wicked weapons.; This Pokémon has gorgeous, glossy feathers. Many Trainers are so captivated by the beautiful feathers on its head that they choose Pidgeot as their Pokémon.; By flapping its wings with all its might, Pidgeot can make a gust of wind capable of bending tall trees.; When hunting, it skims the surface of water at high speed to pick off unwary prey such as Magikarp.; It spreads its gorgeous wings widely to intimidate enemies. It races through the skies at Mach 2 speed.; Its well developed chest muscles make it strong enough to whip up a gusty windstorm with just a few flaps.; It spreads its beautiful wings wide to frighten its enemies. It can fly at Mach 2 speed.; This Pokémon has a dazzling plumage of beautifully glossy feathers. Many Trainers are captivated by the striking beauty of the feathers on its head, compelling them to choose Pidgeot as their Pokémon.; Its outstanding vision allows it to spot splashing Magikarp, even while flying at 3300 feet."
