name,id,all_cleaned
Ditto,132,"Ditto: id: 132 - nickname: Transform Pokémon - type: normal - height: 0.3 - weight: 4.0; descriptions: Its transformation ability is per fect. However, if made to laugh, it can't maintain its disguise.; Capable of copying an enemy's genetic code to instantly transform itself into a duplicate of the enemy.; When it spots an enemy, its body transfigures into an almost perfect copy of its opponent.; When it encount ers another Ditto, it will move faster than normal to duplicate that opponent exactly.; With its astonishing capacity for metamorphosis, it can get along with anything. It does not get along well with its fellow Ditto.; It transforms into whatever it sees. If the thing it's transforming into isn't right in front of it, Ditto relies on its memory so sometimes it fails.; It can reconstitute its entire cellular structure to change into what it sees, but it returns to normal when it relaxes.; Capable of copying an opponent's genetic code to instantly transform itself into a duplicate of the enemy.; While it can transform into anything, each Ditto apparently has its own strengths and weaknesses when it comes to transformations.; Ditto rearranges its cell structure to transform itself into other shapes. However, if it tries to transform itself into something by relying on its memory, this Pokémon manages to get details wrong.; It can transform into anything. When it sleeps, it changes into a stone to avoid being attacked.; It can reorganize its cells to make itself into a duplicate of anything it sees. The quality of the duplicate depends on the individual.; A Ditto rearranges its cell structure to transform itself. However, if it tries to change based on its memory, it will get details wrong.; It has the ability to reconstitute its entire cellular structure to transform into whatever it sees.; It can freely recombine its own cellular structure to transform into other life forms."
Eevee,133,"Eevee: id: 133 - nickname: Evolution Pokémon - type: normal - height: 0.3 - weight: 6.5; descriptions: An extremely rare Pokémon that may evolve in a number of different ways depending on stimuli.; Eevee has an unstable genetic makeup that suddenly mutates due to the environment in which it lives. Radiation from various stones causes this Pokémon to evolve.; Its irregularly configured Dna is affected by its surroundings. It evolves if its en vironment changes.; Because its genetic makeup is irregular, it quickly changes its form due to a variety of causes.; Its genetic code is unstable, so it could evolve in a variety of ways. There are only a few alive.; The question of why only Eevee has such unstable genes has still not been solved.; A rare Pokémon that adapts to harsh environments by taking on different evolutionary forms.; It can evolve into a variety of forms. Eevee's genes are the key to solving the mysteries of Pokémon evolution.; Thanks to its unstable genetic makeup, this special Pokémon conceals many different possible evolutions.; Its ability to evolve into many forms allows it to adapt smoothly and perfectly to any environment.; Harbors the potential to evolve into manifold forms. Within Eevee lies the key to the mysteries of Pokémon evolution I'm certain of it.; Possessing an unbalanced and unstable genetic makeup, it conceals many possible evolutions.; Its genetic code is irregular. It may mutate if it is exposed to radiation from element Stones.; Current studies show it can evolve into an incredible eight different species of Pokémon.; It has the ability to alter the com position of its body to suit its surrounding envi ronment.; An Eevee has an unstable genetic makeup that suddenly mutates due to its environment. Radiation from various Stones causes this Pokémon to evolve.; Its genes are easily influenced by its surroundings. Even its face starts to look like that of its Trainer."
Vaporeon,134,"Vaporeon: id: 134 - nickname: Bubble Jet Pokémon - type: water - height: 1.0 - weight: 29.0; descriptions: As it uses the fins on the tip of its tail to swim, it blends with the water perfectly.; Its cell composition is similar to water molecules. As a result, it can melt away into water.; Vaporeon underwent a spontaneous mutation and grew fins and gills that allow it to live underwater. This Pokémon has the ability to freely control water.; It detects nearby moisture with its fin. When its fin begins trembling rapidly, that means rain will fall in a few hours.; Its cell structure is similar to water molecules. It melts into the water and becomes invisible.; Its cell composition is similar to water molecules. As a result, it can't be seen when it melts away into water.; Its cells are composed of units much like water molecules. It lives close to water and is often mistaken for a mermaid.; Tests show that its cells closely resemble water molecules, which perhaps explains its ability to conceal its form while submerged. I believe the origins of mermaid folklore lie with this Pokémon.; Vaporeon underwent a spontaneous mutation and grew fins and gills that allow them to live underwater. They have the ability to freely control water.; When Vaporeon's fins begin to vibrate, it is a sign that rain will come within a few hours.; Blending in with the water and erasing all signs of its presence, it patiently waits for its prey, fish Pokémon.; Its body's cellular structure is similar to the molecular composition of water. It can melt invisibly in water.; It prefers beautiful shores. With cells similar to water molecules, it could melt in water.; Clean, clear waters are its usual habitat. When it's about to be attacked by an invading enemy, it dives into the water to hide.; Its cell structure is similar to water molecules. It will melt away and become invis ible in water.; It has evolved to be suitable for an aquatic life. It can invisibly melt away into water.; Lives close to water. Its long tail is ridged with a fin which is often mistaken for a mermaid's."
Jolteon,135,"Jolteon: id: 135 - nickname: Lightning Pokémon - type: electric - height: 0.8 - weight: 24.5; descriptions: Its fur stands on end, becoming like needles it fires at enemies. Once they're weakened, it finishes them off with a 10,000 volt shock.; They send out electrical charges of about 10,000 volts. Because they are high strung, it can be difficult to grow close to them.; The negatively charged ions generated in its fur create a constant sparking noise.; It concentrates the weak electric charges emitted by its cells and launches wicked lightning bolts.; By storing electricity in its body, it can shoot its bristlelike fur like a barrage of missiles.; If agitated, it uses electricity to straighten out its fur and launch it in small bunches.; Its cells generate weak power that is amplified by its fur's static electricity to drop thunderbolts. The bristling fur is made of electrically charged needles.; It controls 10,000 volt power and can raise all the fur on its body as if it were sharp needles.; Its lungs contain an organ that creates electricity. The crackling sound of electricity can be heard when it exhales.; A sensitive Pokémon that easily becomes sad or angry. Every time its mood changes, it charges power.; Jolteon's cells generate a low level of electricity. This power is amplified by the static electricity of its fur, enabling the Pokémon to drop thunderbolts. The bristling fur is made of electrically charged needles.; Bristles its fur into sharp, needlelike points when enraged. One can hear electricity crackle in its breath when it exhales.; When its fur stands on end, that's a sign it's about to give off a jolt of electricity. Take care, as sometimes lightning strikes next to it, too.; If it is angered or startled, the fur all over its body bristles like sharp needles that pierce foes.; It accumulates negative ions in the atmosphere to blast out 10,000 volt lightning bolts.; Every hair on its body starts to stand sharply on end if it becomes charged with electricity."
Flareon,136,"Flareon: id: 136 - nickname: Flame Pokémon - type: fire - height: 0.9 - weight: 25.0; descriptions: It has a flame bag inside its body. After inhaling deeply, it blows out flames of nearly 3,000 degrees Fahrenheit.; Flames burn within a saclike organ inside this Pokémon. When Flareon inhales, these flames grow in intensity, reaching a mighty 3,000 degrees Fahrenheit.; The flame chamber inside its body ignites when Flareon gets agitated, reaching temperatures of up to 1,650 degrees Fahrenheit.; Once it has stored up enough heat, this Pokémon's body temperature can reach up to 1,700 degrees Fahrenheit.; It has a flame chamber inside its body. It inhales, then breathes out fire that is over 3,000 degrees Fahrenheit.; It fluffs out its fur collar to cool down its body temperature, which can reach 1,650 degrees Fahrenheit.; Once it has stored up enough heat, this Pokémon's body temperature can reach up to 1700 degrees.; It has a flame sac in its body. Its body temperature tops 1,650 degrees Fahrenheit before battle.; Inhaled air is carried to its flame sac, heated, and exhaled as fire that reaches over 3,000 degrees F.; When it catches prey or finds berries, it breathes fire on them until they're well done, and then it gobbles them up.; It has a flame bag inside its body. After inhaling deeply, it blows out flames of nearly 3,100 degrees Fahrenheit.; Flareon's fluffy fur has a functional purpose it releases heat into the air so that its body does not get excessively hot. This Pokémon's body temperature can rise to a maximum of 1,650 degrees Fahrenheit.; It fluffs out its fur collar to cool down its body temperature, which can reach 1,650 degrees.; When storing thermal energy in its body, its temperature could soar to over 1600 degrees.; Flareon's fluffy fur releases heat into the air so that its body does not get excessively hot. Its body temperature can rise to a maximum of 1,650 degrees F.; When storing thermal energy in its body, its temperature can soar to over 1,600 degrees Fahrenheit.; Its average body temperature is between 1,300 and 1,500 degrees Fahrenheit. In its internal flame sac, temperatures reach 3,000 degrees.; It stores some of the air it inhales in its internal flame pouch, which heats it to over 3,000 degrees.; Inhaled air is heated in the flame sac in its body to an intense fire over 3,000 degrees Fahrenheit.; If it inhales deeply, that's a sign it's about to attack. Prepare to be hit by flames of over 3,000 degrees Fahrenheit; Flareon's fluffy fur has a functional purpose it releases heat into the air so that its body does not get excessively hot. This Pokémon's body temperature can rise to a maximum of 1,650 degrees F.; It stores some of the air it inhales in its internal flame pouch, which heats it to over 3,000 degrees Fahrenheit.; It has a flame chamber inside its body. It inhales, then blows out fire that is over 3,000F degrees."
Porygon,137,"Porygon: id: 137 - nickname: Virtual Pokémon - type: normal - height: 0.8 - weight: 36.5; descriptions: It is a manmade Pokémon. Since it doesn't breathe, people are eager to try it in any environment.; An artificial Pokémon created due to extensive research, it can perform only what is in its program.; A Pokémon that consists entirely of programming code. Capable of moving freely in cyberspace.; A manmade Pokémon that came about as a result of re search. It is pro grammed with only basic motions.; The world's first artificially created Pokémon. It can travel through electronic space.; It was built 20 years ago by scientists who dreamed of exploring space. Their dreams have yet to come true.; A Pokémon that consists entirely of programming code. It is capable of moving freely in cyberspace.; Using the most advanced technologies, scientists finally succeeded in making the first artificial Pokémon.; State of the art technology was used to create Porygon. It was the first artificial Pokémon to be created via computer programming.; Porygon is capable of reverting itself entirely back to program data and entering cyberspace. This Pokémon is copy protected so it cannot be duplicated by copying.; Roughly 20 years ago, it was artificially created, utilizing the latest technology of the time.; It is capable of reverting itself entirely back to program data in order to enter cyberspace. A Porygon is copy protected so it cannot be duplicated.; A man made Pokémon created using advanced scientific means. It can move freely in cyberspace.; It has no discernible heartbeat and does not seem to draw breath, and yet it appears to function without issue. I cannot even begin to explain this utterly bizarre anomaly.; This Pokémon was created using the cutting edge science of 20 years ago, so many parts of it have since become obsolete.; In recent years, this species has been very helpful in cyberspace. These Pokémon will go around checking to make sure no suspicious data exists.; It can convert its body into digital data, which enables it to enter cyberspace.; The only Pokémon people anticipate can fly into space. None has managed the feat yet, however.; The only Pokémon that people anticipate can fly into space. None has managed the feat yet, however."
Omanyte,138,"Omanyte: id: 138 - nickname: Spiral Pokémon - type: rock and water - height: 0.4 - weight: 7.5; descriptions: Although long extinct, in rare cases, it can be genetically regenerated from fossils.; An ancient Pokémon that was recovered from a fossil. It swam by cleverly twisting its 10 tentacles about.; One of the ancient and long since extinct Pokémon that have been regenerated from fossils by humans. If attacked, it withdraws into its hard shell.; This Pokémon from ancient times is said to have navi gated the sea by adeptly twisting its 10 tentacles.; Because some Omanyte manage to escape after being restored or are released into the wild by people, this species is becoming a problem.; A prehistoric Pokémon that lived in the primordial sea, it swims by twisting its 10 tentacles about.; Omanyte lived in the seas of antiquity. Its fossils have been found bearing bite marks from Archeops, so apparently Archeops preyed on it.; An ancient Pokémon that was recovered from a fossil. It swims by cleverly twisting its 10 tentacles about.; Omanyte is one of the ancient and long since extinct Pokémon that have been regenerated from fossils by people. If attacked by an enemy, it withdraws itself inside its hard shell.; This Pokémon is a member of an ancient, extinct species. Omanyte paddles through water with its 10 tentacles, looking like it's just drifting along.; A Pokémon that was resurrected from a fossil using modern science. It swam in ancient seas.; Although long extinct, in rare cases, it can be genetically resurrected from fossils.; Revived from an ancient fossil, this Pokémon uses air stored in its shell to sink and rise in water.; In prehistoric times, it swam on the sea floor, eating plankton. Its fossils are sometimes found.; It was restored from an ancient fossil. Those Helix Fossils are excavated from areas that were once oceans long, long ago."
Omastar,139,"Omastar: id: 139 - nickname: Spiral Pokémon - type: rock and water - height: 1.0 - weight: 35.0; descriptions: Omastar uses its tentacles to capture its prey. It is believed to have become extinct because its shell grew too large and heavy, causing its movements to become too slow and ponderous.; Sharp beaks ring its mouth. Its shell was too big for it to move freely, so it became extinct.; It wraps its prey in its tentacles to immobilize them and then finishes them off with its sharp fangs.; It is thought that this Pokémon became extinct because its spiral shell grew too large.; Apparently, it cracked Shellder's shell with its sharp fangs and sucked out the insides.; Once wrapped around its prey, it never lets go. It eats the prey by tearing at it with sharp fangs.; Its heavy shell allowed it to reach only nearby food. This could be the reason it is extinct.; Weighed down by a large and heavy shell, Omastar couldn't move very fast. Some say it went extinct because it was unable to catch food.; Its tentacles are highly developed as if they are hands and feet. As soon as it ensnares prey, it bites.; Despite having strong fangs and tentacles, it went extinct when its heavy shell made it unable to catch prey.; Its sharp beak rings its mouth. Its shell was too big for it to move freely, so it became extinct.; Omastar's sharp fangs could crush rock, but the Pokémon can attack only the prey that come within reach of its tentacles.; Its heavy shell is thought to be the reason this ancient Pokémon died out. It's apparently a distant ancestor of Octillery.; A prehistoric Pokémon that died out when its heavy shell made it impossible to catch prey.; An Omastar uses its tentacles to capture its prey. It is believed to have become extinct because its shell grew too large, making its movements slow and ponderous."
Kabuto,140,"Kabuto: id: 140 - nickname: Shellfish Pokémon - type: rock and water - height: 0.5 - weight: 11.5; descriptions: A Pokémon that was regenerated from a fossil found in what was once the ocean floor long ago.; Kabuto is a Pokémon that has been regenerated from a fossil. However, in extremely rare cases, living examples have been discovered. The Pokémon has not changed at all for 300 million years.; This Pokémon lived in ancient times. On rare occasions, it has been discovered as a living fossil.; On rare occasions, some have been found as fossils which they became while hiding on the ocean floor.; A Pokémon that was recovered from a fossil. It used the eyes on its back while hiding on the seafloor.; This species is almost entirely extinct. Kabuto molt every three days, making their shells harder and harder.; It is a Pokémon that has been regenerated from a fossil. However, in rare cases, living examples have been discovered. Kabuto have not changed for 300 million years.; It is thought to have inhabited beaches 300 million years ago. It is protected by a stiff shell.; A Pokémon that was recovered from a fossil. It uses the eyes on its back while hiding on the sea floor.; A Pokémon that was resurrected from a fossil found in what was once the ocean floor eons ago.; This Pokémon became extinct everywhere, except in a few areas. It protects itself with its hard shell.; Three hundred million years ago, it hid on the sea floor. It also has eyes on its back that glow.; This Pokémon thrived 300 million years ago. It's said that living specimens can still be seen in a certain region a rare sight.; While some say this species has gone extinct, Kabuto sightings are apparently fairly common in some places.; This Pokémon was regenerated from the fossil of an ancient creature. It protects itself with a hard shell."
Kabutops,141,"Kabutops: id: 141 - nickname: Shellfish Pokémon - type: rock and water - height: 1.3 - weight: 40.5; descriptions: Its body had begun to change so it could function on land. But it didn't adapt in time and went extinct.; Its sleek shape is perfect for swim ming. It slashes prey with its claws and drains the body fluids.; Kabutops once swam underwater to hunt for prey. It was apparently evolving from being a water dweller to living on land as evident from changes in its gills and legs.; A slim and fast swimmer. It slices its prey with its sharp sickles and drinks the body fluids.; In the water, it tucks in its limbs to become more compact, then it wiggles its shell to swim fast.; It swims at speeds of roughly 29 knots, quickly closing in on its prey and slashing into them with its scythes to finish them off.; It swims freely through water. It catches prey with its scythe like arms and drains the victim's fluids.; It is thought that this Pokémon came onto land because its prey adapted to life on land.; A slim and fast swimmer. It sliced its prey with its sharp sickles and drank the body fluids.; With sharp claws, this ferocious, ancient Pokémon rips apart prey and sucks their body fluids.; Kabutops swam underwater to hunt for its prey in ancient times. The Pokémon was apparently evolving from being a water dweller to living on land as evident from the beginnings of change in its gills and legs.; Its sleek shape is perfect for swimming. It slashes prey with its claws and drains their fluids.; The cause behind the extinction of this species is unknown. Kabutops were aggressive Pokémon that inhabited warm seas.; It was able to swim quickly thro ugh the water by compactly folding up its razor sharp sickles.; Kabutops slices its prey apart and sucks out the fluids. The discarded body parts become food for other Pokémon."
Aerodactyl,142,"Aerodactyl: id: 142 - nickname: Fossil Pokémon - type: rock and flying - height: 1.8 - weight: 59.0; descriptions: A vicious Pokémon from the distant past, it appears to have flown by spreading its wings and gliding.; A Pokémon from the age of the dinosaurs. It used its sawlike fangs to shred its prey before eating them.; Aerodactyl is a Pokémon from the age of dinosaurs. It was regenerated from genetic material extracted from amber. It is imagined to have been the king of the skies in ancient times.; In ancient times, it ruled the skies. A widely accepted theory is that it went extinct due to a large meteor impact.; A ferocious, pre historic Pokémon that goes for the enemy's throat with its serrated saw like fangs.; Aerodactyl's sawlike fangs can shred skin to tatters even the skin of Steel type Pokémon.; It was regenerated from a dinosaur's genetic matter that was found in amber. It flies with high pitched cries.; A savage Pokémon that died out in ancient times. It was resurrected using Dna taken from amber.; It flew through the open skies over the ancient continent as if they were its own. When it touched ground, its walk was weak and slow.; A Pokémon that roamed the skies in the dinosaur era. Its teeth are like saw blades.; This vicious Pokémon is said to have flown in ancient skies while shrieking high pitched cries.; Restored from Dna found in amber, this Pokémon exhibited ferocity that was greater than expected. Some casualties resulted.; This is a ferocious Pokémon from ancient times. Apparently even modern technology is incapable of producing a perfectly restored specimen.; In prehistoric times, this Pokémon flew freely and fearlessly through the skies.; Aerodactyl is a Pokémon from the age of dinosaurs. It was regenerated from Dna extracted from amber. It is imagined to have been the king of the skies."
Snorlax,143,"Snorlax: id: 143 - nickname: Sleeping Pokémon - type: normal - height: 2.1 - weight: 460.0; descriptions: It has no interest in anything other than eating. Even if you climb up on its stomach while it's napping, it doesn't seem to mind at all; Very lazy. Just eats and sleeps. As its rotund bulk builds, it becomes steadily more slothful.; This glutton appears in villages without warning and devours the entirety of their rice granaries such occurrences have long been counted among the gravest of disasters.; Will eat anything, even if the food happens to be a little moldy. It never gets an upset stomach.; It eats nearly 900 pounds of food every day. It starts nodding off while eating and continues to eat even while it's asleep.; Snorlax's typical day consists of nothing more than eating and sleeping. It is such a docile Pokémon that there are children who use its expansive belly as a place to play.; Its stomach's digestive juices can dissolve any kind of poison. It can even eat things off the ground.; Its stomach is said to be incomparably strong. Even Muk's poison is nothing more than a hint of spice on Snorlax's tongue.; What sounds like its cry may ac tually be its snores or the rumblings of its hungry belly.; It stops eating only to sleep. It doesn't feel full unless it eats nearly 900 pounds a day.; It doesn't do anything other than eat and sleep. When prompted to make a serious effort, though, it apparently displays awesome power.; This Pokémon's stomach is so strong, even eating moldy or rotten food will not affect it.; Its stomach can digest any kind of food, even if it happens to be moldy or rotten.; When its belly is full, it becomes too lethargic to even lift a finger, so it is safe to bounce on its belly.; It is not satisfied unless it eats over 880 pounds of food every day. When it is done eating, it goes promptly to sleep.; Snorlax's typical day consists of nothing more than eating and sleeping. It is such a docile Pokémon that there are children who use its big belly as a place to play."
Articuno,144,"Articuno: id: 144 - nickname: Freeze Pokémon - type: ice and flying - height: 1.7 - weight: 55.4; descriptions: Legendary bird Pokémon. As it flies through the sky, it cools the air, causing snow to fall.; Articuno is a legendary bird Pokémon that can control ice. The flapping of its wings chills the air. As a result, it is said that when this Pokémon flies, snow will fall.; One of the legendary bird Pokémon, it chills moisture in the atmosphere to create snow while flying.; A legendary bird Pokémon. It can create blizzards by freezing moisture in the air.; The magnificent, seemingly translucent wings of this legendary bird Pokémon are said to be made of ice.; This Pokémon can control ice at will. Articuno is said to live in snowy mountains riddled with permafrost.; It's said that this Pokémon's beautiful blue wings are made of ice. Articuno flies over snowy mountains, its long tail fluttering along behind it.; One of the legendary bird Pokémon. With its long tail trailing behind, its flying form is magnificent.; A legendary bird Pokémon. It freezes water that is contained in winter air and makes it snow.; A legendary bird Pokémon that is said to appear to doomed people who are lost in icy mountains."
